{
  "$schema": "../../schemas/capability_registry.schema.json",
  "registry_id": "science_capability_registry.capability_catalog",
  "schema_version": "0.1.0",
  "catalog_role": "capability_routing_and_evidence_index",
  "capabilities": [
    {
      "capability_id": "combustion.cantera.constant_pressure_ignition",
      "asset_id": "C01_constant_pressure_ignition",
      "software": "Cantera",
      "domain": "combustion",
      "asset_path": "software/cantera/assets/C01_constant_pressure_ignition.yaml",
      "run_schema_path": "schemas/cantera_C01_constant_pressure_ignition.schema.json",
      "default_config_path": "configs/cantera/c01_constant_pressure_ignition/baseline.yaml",
      "package_entrypoint": "science_capability_registry.cantera.c01_constant_pressure_ignition:run",
      "card_status": "accepted",
      "benchmark_status": "benchmark_validated",
      "evidence_ids": [
        "cantera_C01_ignition_validation"
      ],
      "result_contract": {
        "required_files": [
          "manifest.json",
          "metrics.json",
          "validation.json",
          "validation_report.md"
        ],
        "report_file": "validation_report.md",
        "runtime_evidence_index": "reports/evidence_index.yaml"
      },
      "benchmark_manifest_path": "benchmarks/cantera_c01_constant_pressure_ignition/benchmark_manifest.json",
      "dispatch_status": "replay_ready",
      "current_gate": "integration",
      "primary_evidence_id": "cantera_C01_ignition_validation"
    },
    {
      "capability_id": "combustion.cantera.freely_propagating_premixed_flame",
      "asset_id": "C02_freely_propagating_premixed_flame",
      "software": "Cantera",
      "domain": "combustion",
      "asset_path": "software/cantera/assets/C02_freely_propagating_premixed_flame.yaml",
      "run_schema_path": "schemas/cantera_C02_freely_propagating_premixed_flame.schema.json",
      "default_config_path": "configs/cantera/c02_freely_propagating_premixed_flame/baseline.yaml",
      "package_entrypoint": "science_capability_registry.cantera.c02_freely_propagating_premixed_flame:run",
      "card_status": "accepted",
      "benchmark_status": "benchmark_validated",
      "evidence_ids": [
        "cantera_C02_flame_speed_validation"
      ],
      "result_contract": {
        "required_files": [
          "manifest.json",
          "metrics.json",
          "validation.json",
          "validation_report.md"
        ],
        "report_file": "validation_report.md",
        "runtime_evidence_index": "reports/evidence_index.yaml"
      },
      "dispatch_status": "replay_ready",
      "current_gate": "integration",
      "primary_evidence_id": "cantera_C02_flame_speed_validation"
    },
    {
      "capability_id": "combustion.cantera.counterflow_diffusion_flame",
      "asset_id": "C03_counterflow_diffusion_flame",
      "software": "Cantera",
      "domain": "combustion",
      "asset_path": "software/cantera/assets/C03_counterflow_diffusion_flame.yaml",
      "run_schema_path": "schemas/cantera_C03_counterflow_diffusion_flame.schema.json",
      "default_config_path": "configs/cantera/c03_counterflow_diffusion_flame/baseline.yaml",
      "package_entrypoint": "science_capability_registry.cantera.c03_counterflow_diffusion_flame:run",
      "card_status": "accepted",
      "benchmark_status": "benchmark_validated",
      "evidence_ids": [
        "cantera_C03_baseline_validation"
      ],
      "result_contract": {
        "required_files": [
          "manifest.json",
          "metrics.json",
          "validation.json",
          "validation_report.md"
        ],
        "report_file": "validation_report.md",
        "runtime_evidence_index": "reports/evidence_index.yaml"
      },
      "dispatch_status": "replay_ready",
      "current_gate": "integration",
      "primary_evidence_id": "cantera_C03_baseline_validation"
    },
    {
      "capability_id": "combustion.cantera.extinction_strain_rate",
      "asset_id": "C04_extinction_strain_rate",
      "software": "Cantera",
      "domain": "combustion",
      "asset_path": "software/cantera/assets/C04_extinction_strain_rate.yaml",
      "run_schema_path": "schemas/cantera_C04_extinction_strain_rate.schema.json",
      "default_config_path": "configs/cantera/c04_extinction_strain_rate/baseline.yaml",
      "package_entrypoint": "science_capability_registry.cantera.c04_extinction_strain_rate:run",
      "card_status": "accepted",
      "benchmark_status": "benchmark_validated",
      "evidence_ids": [
        "cantera_C04_extinction_validation"
      ],
      "result_contract": {
        "required_files": [
          "manifest.json",
          "metrics.json",
          "validation.json",
          "validation_report.md"
        ],
        "report_file": "validation_report.md",
        "runtime_evidence_index": "reports/evidence_index.yaml"
      },
      "dispatch_status": "replay_ready",
      "current_gate": "integration",
      "primary_evidence_id": "cantera_C04_extinction_validation"
    },
    {
      "capability_id": "combustion.cantera.reaction_path_analysis",
      "asset_id": "C05_reaction_path_analysis",
      "software": "Cantera",
      "domain": "combustion",
      "asset_path": "software/cantera/assets/C05_reaction_path_analysis.yaml",
      "run_schema_path": "schemas/cantera_C05_reaction_path_analysis.schema.json",
      "default_config_path": "configs/cantera/c05_reaction_path_analysis/baseline.yaml",
      "package_entrypoint": "science_capability_registry.cantera.c05_reaction_path_analysis:run",
      "card_status": "accepted",
      "benchmark_status": "benchmark_validated",
      "evidence_ids": [
        "cantera_C05_reaction_path_validation"
      ],
      "result_contract": {
        "required_files": [
          "manifest.json",
          "metrics.json",
          "validation.json",
          "validation_report.md"
        ],
        "report_file": "validation_report.md",
        "runtime_evidence_index": "reports/evidence_index.yaml"
      },
      "dispatch_status": "replay_ready",
      "current_gate": "integration",
      "primary_evidence_id": "cantera_C05_reaction_path_validation"
    },
    {
      "capability_id": "combustion.cantera.mechanism_reduction",
      "asset_id": "C06_mechanism_reduction",
      "software": "Cantera",
      "domain": "combustion",
      "asset_path": "software/cantera/assets/C06_mechanism_reduction.yaml",
      "run_schema_path": "schemas/cantera_C06_mechanism_reduction.schema.json",
      "default_config_path": "configs/cantera/c06_mechanism_reduction/baseline.yaml",
      "package_entrypoint": "science_capability_registry.cantera.c06_mechanism_reduction:run",
      "card_status": "accepted",
      "benchmark_status": "benchmark_validated",
      "evidence_ids": [
        "cantera_C06_mechanism_reduction_validation"
      ],
      "result_contract": {
        "required_files": [
          "manifest.json",
          "metrics.json",
          "validation.json",
          "validation_report.md"
        ],
        "report_file": "validation_report.md",
        "runtime_evidence_index": "reports/evidence_index.yaml"
      },
      "dispatch_status": "replay_ready",
      "current_gate": "integration",
      "primary_evidence_id": "cantera_C06_mechanism_reduction_validation"
    },
    {
      "capability_id": "cfd.openfoam.lid_driven_cavity_incompressible_laminar",
      "asset_id": "C01_lid_driven_cavity_incompressible_laminar",
      "software": "OpenFOAM",
      "domain": "CFD",
      "asset_path": "software/openfoam/assets/C01_lid_driven_cavity_incompressible_laminar.yaml",
      "run_schema_path": "schemas/openfoam_C01_lid_driven_cavity_incompressible_laminar.schema.json",
      "default_config_path": "configs/openfoam/lid_driven_cavity_incompressible_laminar/baseline.yaml",
      "package_entrypoint": "science_capability_registry.openfoam.lid_driven_cavity_incompressible_laminar:run",
      "card_status": "accepted",
      "benchmark_status": "benchmark_validated",
      "evidence_ids": [
        "openfoam_C01_benchmark_validation"
      ],
      "result_contract": {
        "required_files": [
          "manifest.json",
          "metrics.json",
          "validation.json",
          "validation_report.md"
        ],
        "report_file": "validation_report.md",
        "runtime_evidence_index": "reports/evidence_index.yaml"
      },
      "runtime_profile_path": "configs/openfoam/runtime_profiles/openfoam_com_v2112.yaml",
      "benchmark_manifest_path": "benchmarks/openfoam_c01_lid_driven_cavity/benchmark_manifest.json",
      "dispatch_status": "replay_ready",
      "current_gate": "integration",
      "primary_evidence_id": "openfoam_C01_benchmark_validation"
    },
    {
      "capability_id": "cfd.openfoam.potential_flow_cylinder_analytical_validation",
      "asset_id": "C02_potential_flow_cylinder_analytical_validation",
      "software": "OpenFOAM",
      "domain": "CFD",
      "asset_path": "software/openfoam/assets/C02_potential_flow_cylinder_analytical_validation.yaml",
      "run_schema_path": "schemas/openfoam_C02_potential_flow_cylinder_analytical_validation.schema.json",
      "default_config_path": "configs/openfoam/potential_flow_cylinder_analytical_validation/baseline.yaml",
      "package_entrypoint": "science_capability_registry.openfoam.potential_flow_cylinder_analytical_validation:run",
      "card_status": "review",
      "benchmark_status": "package_skeleton_created",
      "evidence_ids": [
        "openfoam_C02_static_readiness_2026-06-30",
        "openfoam_C02_runtime_smoke_attempt_2026-06-30"
      ],
      "result_contract": {
        "required_files": [
          "manifest.json",
          "metrics.json",
          "validation.json",
          "validation_report.md"
        ],
        "report_file": "validation_report.md",
        "runtime_evidence_index": "reports/evidence_index.yaml"
      },